{
  "schema": 1,
  "date": "2026-10-30",
  "period": "daily",
  "languages": ["all", "go"],
  "count": 2,
  "degraded": true,
  "contentHash": "sha256:b1c2d3e4f5a6b7c8d9e0f1a2b3c4d5e6f7a8b9c0d1e2f3a4b5c6d7e8f9a0b1c2",
  "coreVersion": "0.1.0",
  "generatedAt": "2026-10-30T00:05:00Z",
  "repos": [
    {
      "fullName": "golang/go",
      "url": "https://github.com/golang/go",
      "description": "The Go programming language",
      "language": "go",
      "stars": 126000,
      "starsInPeriod": 0,
      "forks": 17800,
      "rank": 1,
      "source": "search-api",
      "summaryZh": "[原文] The Go programming language",
      "summarySource": "original"
    },
    {
      "fullName": "gin-gonic/gin",
      "url": "https://github.com/gin-gonic/gin",
      "description": "HTTP web framework written in Go",
      "language": "go",
      "stars": 80200,
      "starsInPeriod": 0,
      "forks": 8100,
      "rank": 2,
      "source": "search-api",
      "summaryZh": "[原文] HTTP web framework written in Go",
      "summarySource": "original"
    }
  ]
}
